Site ID,Site,ASPRO,Country,Region,Latitude,Longitude,Context,Notes,Citations,Chemical Characterization,Laboratory,Analytical Methods,Obsidian analyzed,Agicol,Gollu Dag East,Gollu Dag West,Nenezi Dag,Hasan Dag,Erciyes Dag,Erzincan,Erzerum,Pasinler,Sarikamis,Kars-Kagisman,Ikizdere,Bingol B,Nemrut Dag / Bingol A,Meydan Dag,Tendurek Dag,Suphan Dag,Mus,Kechut,Aragats / Arteni,Gegham,Vardenis / Khorapor,Sjunik,Baksan,Gutanasar,Kojun Dag / Chikiani,Hatis,West Anatolia,Demenegaki,Sta Nychia,Giali,3d high in rubidium,1e-f,Unknown
5_29,Yarim I,5,Iraq,Jezireh,36.35,42.35,niv. VIII-VI: Hassuna; niv. V-I: Hassuna with Samarra,"Bader's specimens from Yarim I correspond with Proto-Hassuna, ""Hassuna archaique"" and Hassuna standard""","Bader, N.O. 1994; Merpert, N. and Munchaev, R. 1987; Francaviglia, V. 1994","Bader, N.O. 1994; Chataigner 1998:304",,XRF; NAA,17,0,0,0,0,0,0,0,0,0,0,0,0,1,16,0,0,0,0,0,0,0,0,0,0,0,0,0,0,0,0,0,0,0,0
6_1,Ali Kosh,6,Iran,Southern Zagros,32.55,47.4,Mohammad Jaffar phase,,"Renfrew, C. 1977; Renfrew, C. et al 1966","Renfrew, C. 1977; Renfrew, C. et al 1966",,OES,4,0,0,0,0,0,0,0,0,0,0,0,0,2,2,0,0,0,0,0,0,0,0,0,0,0,0,0,0,0,0,0,0,0,0
6_2,Byblos,6,Lebanon,Northern Levant,34.116667,35.65,néolithique Ancien de Byblos (partie supérieure).,,"Renfrew, C. et al 1966; Cauvin, J. 1962","Renfrew, C. et al 1966",,OES,3,2,1,0,0,0,0,0,0,0,0,0,0,0,0,0,0,0,0,0,0,0,0,0,0,0,0,0,0,0,0,0,0,0,0
6_3,Catalhoyuk,6,Turkey,Central Anatolia,37.666454,32.828349,West Mound; TP Sequence,"Analyses done prior to 1999 are ignored (see Carter, T. et al 2006: 894-895). Is it odd that Catal East and West are contemporaries? ","Carter, T. et al 2006; Carter, T. 2014 (pers. comm.); Cessford, C. 2001","Carter, T. et al 2006; Carter, T. 2014 (pers. comm.)",Aberystwyth; CNRS,LA-ICP-MS; ED-XRF; PIXE; SEM-EDS,76,1,39,0,35,0,0,0,0,0,0,0,0,0,1,0,0,0,0,0,0,0,0,0,0,0,0,0,0,0,0,0,0,0,0
6_4,Choga Mami,6,Iraq,Mesopotamian plain,33.88333333,45.45,Samarran/Halaf/Transitional,"Unstratified finds: 1xB1, 6xB2, 1xB3, 16xG1, 2xG2, 2xG3 = 28 total","Mortensen, P. 1973; Epstein, S.M. 1977","Epstein, S.M. 1977",,NAA,47,0,0,0,0,0,0,0,0,0,0,0,0,11,23,4,0,0,0,0,0,0,0,0,0,0,0,0,0,0,0,0,0,0,9
6_5,Choga Sefid,6,Iran,Southern Zagros,32.616667,47.25,Zone B2 - Sefid Phase,,"Hole, F. 1977; Renfrew, C. 1977","Renfrew, C. 1977",,OES,18,0,0,0,0,0,0,0,0,0,0,0,0,12,6,0,0,0,0,0,0,0,0,0,0,0,0,0,0,0,0,0,0,0,0
6_6,Coskuntepe,6,Turkey,Western Anatolia,39.483333,26.083333,,,"Takaoglu, T. 2005; Perles, C. et al 2011","Perles, C. et al 2011",,XRF; LA-HR-ICP-MS,3,0,0,0,0,0,0,0,0,0,0,0,0,0,0,0,0,0,0,0,0,0,0,0,0,0,0,0,0,1,2,0,0,0,0
6_7,Cukurkent,6,Turkey,Central Anatolia,37.883333,31.533333,Middle Neolithic,,"Mellaart, J. 1958; Todd, I. 1980; Wright, G..A. 1969; Renfrew, C. et al 1966","Wright, G..A. 1969; Renfrew, C. et al 1966",,OES,5,0,0,0,5,0,0,0,0,0,0,0,0,0,0,0,0,0,0,0,0,0,0,0,0,0,0,0,0,0,0,0,0,0,0
6_8,El Kowm 2,6,Syria,Northern Levant,35.183333,38.866667,PNA,,"Cauvin, J. et al 1979; Gratuze, B. et al 1993; Cauvin, M.C. et al 1991; Cauvin, M.C. 1991; Chataigner, C. 1998:283","Gratuze, B. et al 1993; Cauvin, M.C. et al 1991",,NAA; XRF; PIGE,3,0,1,0,0,0,0,0,0,0,0,0,0,1,1,0,0,0,0,0,0,0,0,0,0,0,0,0,0,0,0,0,0,0,0
6_9,Ghoraife,6,Syria,Central Levant,33.516667,36.533333,"Phase 2, approximately 6400-6100 cal BC",,"De Contenson, H. 1995; Garfinkel, Y. 2008; Cauvin, M.-C. 1975; McDaniels, J. et al 1980","McDaniels, J. et al 1980",,NAA,18,0,4,0,0,0,0,0,0,0,0,0,0,7,7,0,0,0,0,0,0,0,0,0,0,0,0,0,0,0,0,0,0,0,0
6_10,Hacilar,6,Turkey,Central Anatolia,37.716667,30.066667,"niv. IX-VI: Late Pottery Neolithic, apres un hiatus; niv. V-II: Early Chalcolithic","Renfrew's analyses were re-done by Gale who made a correction, that one of the 1e-f was actually Demenegaki. ","Mortensen, P. 1970:153-157; Renfrew, C. et al 1966; Wright, G.A. 1969","Renfrew, C. et al 1966; Gale, N.H. 1981",,OES; Strontium Isotope Analysis,4,3,0,0,0,0,0,0,0,0,0,0,0,0,0,0,0,0,0,0,0,0,0,0,0,0,0,0,0,1,0,0,0,0,0
6_11,Halula,6,Syria,Middle Euphrate,36.416667,38.166667,Halaf,,"Pernicka, E. et al 1997; Molist, M. et al 1994; Molist, M. and Ferrer, A. 1996","Bellot-Gurlet, 1998; Pernicka, E. et al 1997",Pernicka et al 1997; Schneider pers comm.; Bellot-Gurlet 1998,INAA; XRF,15,3,1,0,0,0,0,0,0,0,0,0,0,5,6,0,0,0,0,0,0,0,0,0,0,0,0,0,0,0,0,0,0,0,0
6_12,Hassuna,6,Iraq,Jezireh,36.033333,43.216667,"niv. Ib, Ic, II: Hassunan (""civilisation de Hassuna""); niv. III - VI: ""Hassunan with Samarran"" (importations?)",,"Wright, G.A. 1969","Wright, G.A. and Gordus, A.A. 1969",,OES,1,0,0,0,0,0,0,0,0,0,0,0,0,0,1,0,0,0,0,0,0,0,0,0,0,0,0,0,0,0,0,0,0,0,0
6_13,Ilipinar,6,Turkey,Western Anatolia,40.45,29.3,Phase X,Some are analyzed using Fission Track Dating,"Gatsov 2008; Roodenberg and Roodenberg 2008; Ozdogan, M. and Gatsov, I. 1998; Gatsov, I. 2003; Bigazzi, G. 1993; Gatsov, I. 2001; Gatsov, I. 2009; Roodenberg, J.J. et al 1995; Roodenberg, J.J. et al 2001; Roodenberg, J.J. et al 2008; Roodenberg, J.J. et al 1990","Bigazzi, G. et al 1995",,INAA; FT,3,0,1,0,0,0,0,0,0,0,0,0,0,0,0,0,0,0,0,0,0,0,0,0,0,0,0,0,2,0,0,0,0,0,0
6_14,Kabri,6,Israel,Southern Levant,33.016667,35.133333,,,"Kempinsky, A. 2002; Prausnitz, M.W. 1970; Renfrew, C. et al 1966; Stekelis, M. 1958","Renfrew, C. et al 1966",,OES,1,0,0,0,0,0,0,0,0,0,0,0,0,1,0,0,0,0,0,0,0,0,0,0,0,0,0,0,0,0,0,0,0,0,0
6_15,Klepini-Troulli,6,Cyprus,Cyprus,35.2978,33.4448,,Not in ASPRO. ,"Gomez, B. et al 1995; Buchholz, H.G. 1971; Peltenberg, E.J. 1979","Buchholz, H.G. 1971; Peltenberg, E.J. 1979",,XRF,3,0,3,0,0,0,0,0,0,0,0,0,0,0,0,0,0,0,0,0,0,0,0,0,0,0,0,0,0,0,0,0,0,0,0
6_16,Matarrah,6,Iraq,Jezireh,35.2,43.366667,"niv. 2-1 (opération VI) et opération IX (=Upper)., Samarran",,"Braidwood, R. and Howe, B. 1960; Renfrew, C. et al 1966","Renfrew, C. et al 1966; Wright, G.A. and Gordus, A.A. 1969",,OES,3,0,0,0,0,0,0,0,0,0,0,0,0,0,3,0,0,0,0,0,0,0,0,0,0,0,0,0,0,0,0,0,0,0,0
6_17,Mersin,6,Turkey,Central Anatolia,36.833333,34.566667,period 6[1] = niv. XXVII: Late Neolithic ou Upper Neolithic ; period 6[2] = niv. XXVI-XXIV : Proto-Chalcolithic.,,"Brice, W.C. 1953; Renfrew, C. et al 1966; Wright, G.A. 1969","Renfrew, C. et al 1966",,OES,5,0,3,0,0,0,0,0,0,0,0,0,0,0,0,0,0,0,0,0,0,0,0,0,0,0,0,0,0,0,0,0,0,2,0
6_18,Nahal Zehora II,6,Israel,Southern Levant,32.41,34.99,Pottery Neolithic - Yarmoukian,The 2 unknown specimens are of distinct geochemical groups. ,"Delerue, S. et al 2012","Delerue, S. et al 2012",,ICP-MS,7,0,1,0,0,0,0,0,0,0,0,0,0,1,3,0,0,0,0,0,0,0,0,0,0,0,0,0,0,0,0,0,0,0,2
6_19,Nineveh,6,Iraq,Jezireh,36.35,43.166667,période 6[1] = niv. I : Ninevite I (Hassuna) ; période 6[2] = niv. IIa-b : Ninevite II (Hassuna et Samarra).,,"Peltenburg, E.J. 1979","Peltenburg, E.J. 1979",,NAA,2,0,0,0,0,0,0,0,0,0,0,0,0,1,0,1,0,0,0,0,0,0,0,0,0,0,0,0,0,0,0,0,0,0,0
6_20,Okuzini Cave,6,Turkey,Western Anatolia,37.066667,30.066667,Late Neolithic - GH IB1. None of the samples from mixed contexts were included here (there were 9 such samples). ,,"Carter, T. et al 2011","Carter, T. et al 2011",,PIXE,14,0,7,0,7,0,0,0,0,0,0,0,0,0,0,0,0,0,0,0,0,0,0,0,0,0,0,0,0,0,0,0,0,0,0
6_21,Sarab,6,Iran,Southern Zagros,34.366667,47.083333,Level 1C,,"Pullar, J. 1975; Renfrew, C. et al 1966","Renfrew, C. et al 1966; Wright, G.A. and Gordus, A.A. 1969",,OES,6,0,0,0,0,0,0,0,0,0,0,0,0,2,4,0,0,0,0,0,0,0,0,0,0,0,0,0,0,0,0,0,0,0,0
6_22,Tamar Tepe,6,Iran,Northern Zagros,30.91666667,35.45,Hajji Firuz Phase,,"Renfrew, C. 1976; Chataigner, C. et al 2010","Renfrew, C. and Dixon, J. 1976",,OES,1,0,0,0,0,0,0,0,0,0,0,0,0,0,0,1,0,0,0,0,0,0,0,0,0,0,0,0,0,0,0,0,0,0,0
6_23,Tell al-Judaidah,6,Turkey,Northern Levant,36.266667,36.6,niv. XIV (TT 20) et sols 28-25 (JK 3) = Amuq A,The same sample was re-analyzed by Gale 1981. ,"Gale, N.H. 1981","Renfrew, C. et al 1966; Gale, N.H. 1981",,OES; Strontium isotope Analysis,1,0,1,0,0,0,0,0,0,0,0,0,0,0,0,0,0,0,0,0,0,0,0,0,0,0,0,0,0,0,0,0,0,0,0
6_24,Tell Aray 2,6,Syria,Northern Levant,35.583333,36.516667,El Rouj 2c,,"Maeda, O. 2003","Maeda, O. 2003",,ED-XRF; ICP-AES,18,0,10,0,4,0,0,0,0,0,0,0,0,0,2,0,0,0,0,0,0,0,0,0,0,0,0,0,0,0,0,0,0,0,2
6_25,Tell es-Sawwan I,6,Iraq,Jezireh,36.35,39.066667,"niv. I-II (tell ""C"" et bordure du tell ""B""): Early Samarran; niv. IIIa-b (tell ""B""): Middle Samarran",,"Tikriti, A.Q.H.; Copeland, L. 1979; Copeland, L. 1982; Wright, G.A. 1969","Wright, G.A. and Gordus, A.A. 1969",,OES,6,0,0,0,0,0,0,0,0,0,0,0,0,0,4,2,0,0,0,0,0,0,0,0,0,0,0,0,0,0,0,0,0,0,0
6_26,Tell Sabi Abyad I,6,Syria,Jezireh,36.516667,39.1,Early Halaf,,"Akkermans, P.M.M.G. 1993; Copeland, L. 1989; Copeland, L. and Ackermas, M.M.G. 1994; Copeland, L. 1996","Copeland, L. 1989 (analysis done by Boerma, J.A.K.)","Institute of Earth Sciences, State University of Utrecht",Rapid Rock Analysis; ICP,3,0,0,0,0,0,0,0,0,0,0,0,0,1,2,0,0,0,0,0,0,0,0,0,0,0,0,0,0,0,0,0,0,0,0
6_27,Umm Dabighiyah,6,Iraq,Jezireh,35.6,42.4,,,"Hall, M.E. and Shackley, S. 1994; Kirkbride, D. 1972","Hall, M.E. and Shackley, S. 1994",,EDXRF; NAA,3,0,0,0,0,0,0,0,0,0,0,0,0,1,2,0,0,0,0,0,0,0,0,0,0,0,0,0,0,0,0,0,0,0,0
6_28,Yumuktepe,6,Turkey,Central Anatolia,36.833333,34.566667,Early Neolithic,Altinbilek-Algul refers to Gratuze and Boucetta 2006 which is an unpublished report,"Altinbilek-Algul, C. 2011; Gratuze, B. and Boucetta, S. 2006; Calcagnile, L. et al 2010; Zembello, M. 2004; Caneva, I. 1999","Gratuze, B. and Boucetta, S. 2006; Calcagnile, L. et al 2010",,LA-ICP-MS; PIXE; PIGE,42,1,15,0,26,0,0,0,0,0,0,0,0,0,0,0,0,0,0,0,0,0,0,0,0,0,0,0,0,0,0,0,0,0,0
7_1,Aratashen,7,Armenia,Transcaucasia,40.136,44.229,"Late Neolithic, 6000-5400 cal BC",The artefacts listed as Gegham North was simply listed by Chataigner and Gratuze as Gegham. ,"Chataigner, C. and Gratuze, B. 2014","Chataigner, C. and Gratuze, B. 2014",,LA-ICP-MS,30,0,0,0,0,0,0,0,0,0,8,0,0,0,0,0,0,0,0,0,15,1,0,0,0,5,0,1,0,0,0,0,0,0,0
7_2,Arpachiyah,7,Iraq,Jezireh,36.366667,43.2,"Mallowan et Rose: niv. TT10-8/7: Middle Halaf; Hijara: niv. V-IV: Phase 3a; niv. III-II: Phase 3b; Mallowan et Rose: niv. TT7/6-5, carrés FcV2 et FdIV4 (niveau supérieur): Late Halaf; TT5 est mélangé avec de l'Obeid","Carter analyzed two pressure blades from the collection of the Royal Ontario Museum, which most likely come from the Burnt House (Halaf) according to colleagues in Manchester. ","Campbell, S. 2000; Renfrew, C. and Dixon, J. 1976; Renfrew, C. et al 1966; Healey, E. 2007; Forster, N. and Grave, P. 2012; Carter, T. pers comm.","Carter, T. pers comm.",McMaster University,pXRF,2,0,0,0,0,0,0,0,0,0,0,0,0,0,0,2,0,0,0,0,0,0,0,0,0,0,0,0,0,0,0,0,0,0,0
7_3,Ayngerm,7,Turkey,High Valleys,37.4,41.5,Halaf,,"Benedict, P. 1980; Cambel, H. and Braidwood, R. 1980; Wright, G.A. 1969","Wright, G.A. and Gordus, A.A. 1969",,OES,5,0,0,0,0,0,0,0,0,0,0,0,0,0,5,0,0,0,0,0,0,0,0,0,0,0,0,0,0,0,0,0,0,0,0
7_4,Byblos,7,Lebanon,Northern Levant,34.116667,35.65,levées XLV-XLIV: néolithique Moyen de Byblos.,The analysis of one artefact originally analyzed by Renfrew et al 1966 is re-published in Renfrew and Dixon 1976,"Renfrew, C. et al 1966; Cauvin, J. 1962; Renfrew, C. and Dixon, J. 1976","Renfrew, C. et al 1966",,OES,2,0,0,0,0,0,0,0,0,0,0,0,0,1,0,1,0,0,0,0,0,0,0,0,0,0,0,0,0,0,0,0,0,0,0
7_5,Chagar Bazar,7,Syria,Jezireh,36.866667,40.9,niv. 12-7: Middle et Late Halaf (Davidson et McKerrell),,"Mallowan, M.E.L. 1945; Mallowan, M.E.L. 1937; Mallowan, M.E.L. 1936; Renfrew, C. et al 1966; Renfrew, C. and Dixon, J. 1976","Renfrew, C. and Dixon, J. 1976; Renfrew, C. et al 1966; Wright, G.A. 1969; Cann, J.R. and Renfrew, C. 1964",,OES,2,0,0,0,0,0,0,0,0,0,0,0,0,0,1,1,0,0,0,0,0,0,0,0,0,0,0,0,0,0,0,0,0,0,0
7_6,Domuztepe,7,Turkey,Central Anatolia,36.66667,35.48333,"Late Neolithic, Halaf","The analyses by Healey and Campbell 2007 simply compared whether colour could be used to identify source. Only percentages of correct guesses were given, which are quite strange - they do not correspond with whole numbers. For instance, 8 grey artefacts were guessed to be GDE, and according to the authors they were correct with a 32% accuracy. This would mean that 2.56 pieces of obsidian were accurately predicted in regards to their sources. One can not analyze 2.56 pieces of obsidian, and even if one can, why would you? ","Healey, E. 2007; Campbell, S. et al 1999; Healey, E. and Campbell, S. 2007; Carter, E. et al 2003","Healey, E. and Campbell, S. 2007; Healey, E. 2000:101-113",,ICP-MS,50,0,23,0,0,0,0,0,0,6,0,0,0,14,7,0,0,0,0,0,0,0,0,0,0,0,0,0,0,0,0,0,0,0,0
7_7,Givat Ha-Parsa,7,Israel,Southern Levant,31.85,34.7,Equivalent to tail end of Yarmoukian and Jericho IX,,"Yellin, J. and Garfinkel, Y. 1986; Perlman, I. and Yellin, J. 1980; Olami, Y. et al 1977","Perlman, I. and Yellin, J. 1980",,NAA,3,0,3,0,0,0,0,0,0,0,0,0,0,0,0,0,0,0,0,0,0,0,0,0,0,0,0,0,0,0,0,0,0,0,0
7_8,Hajji Firuz Tepe,7,Iran,Northern Zagros,36.98333333,45.48333333,"""période de Hajji Firuz"" (Dyson, Voigt)",,"Chataigner, C. et al 2010; Voight, M.M. 1983; Renfrew, C. and Dixon, J. 1976","Renfrew, C. et al 1966; Renfrew, C. and Dixon, J. 1976",,OES,3,0,0,0,0,0,0,0,0,0,0,0,0,0,0,0,0,0,0,0,0,0,0,3,0,0,0,0,0,0,0,0,0,0,0
7_9,Halaf,7,Syria,Jezireh,36.816667,40.05,,"The specimen examined my Schneider has been attributed to a '3d' source, characterized by high rubidium levels. Since similar instances tend to co-occur with 4c/3a/3c obsidian at various sites, the source is said to be located in the Lake Van region. See Chataigner 1998:316-317 for more details. Both artefacts are attributed to period 7 contexts. ","Healey, E. 2007; Schneider, G. 1990; Wright, G.A. 1969","Schneider, G. 1990; Wright, G.A. and Gordus, A.A. 1969",,OES,2,0,0,0,0,0,0,0,0,0,0,0,0,0,0,1,0,0,0,0,0,0,0,0,0,0,0,0,0,0,0,0,1,0,0
7_10,Ilipinar,7,Turkey,Western Anatolia,40.45,29.3,Phase IX,Some are FT. ,"Gatsov 2008; Roodemberg and Roodenberg 2008; Ozdogan, M. and Gatsov, I. 1998; Gatsov, I. 2003; Bigazzi, G. 1993; Gatsov, I. 2001; Gatsov, I. 2009; Roodenberg, J.J. et al 1995; Roodenberg, J.J. et al 2001; Roodenberg, J.J. et al 2008; Roodenberg, J.J. et al 1990; Bigazzi, G. 1998","Bigazzi, G. et al 1995; Bigazzi, G. 1998",,INAA; FT,4,0,3,0,0,0,0,0,0,0,0,0,0,0,0,0,0,0,0,0,0,0,0,0,0,0,0,0,1,0,0,0,0,0,0
7_11,Kashkashok,7,Syria,Jezireh,36.633333,40.666667,"Halafian, 5500 BC according to Gratuze 1993",,"Matsutani, T. 1991; Hole, F. 1994; Nishiaki, Y. 1990; Gratuze, B. et al 1993","Gratuze, B. et al 1993; Schneider ?",Orleans,PIGE,9,0,0,0,0,0,0,0,0,0,0,0,0,4,4,0,0,0,0,0,0,0,0,0,0,0,0,0,0,0,0,0,1,0,0
7_12,Ras Shamra,7,Syria,Northern Levant,35.6,35.633333,"période 7 (début): niv. IV C: ""Chalcolithique Ancien de Ras Shamra"" = Halaf = Amuq C; période 7 (fin): niv. IV B: ""Chalcolithique Moyen I de Ras Shamra"" = Amuq D",,"Renfrew, C. et al 1966","Renfrew, C. et al 1966",,OES,1,0,1,0,0,0,0,0,0,0,0,0,0,0,0,0,0,0,0,0,0,0,0,0,0,0,0,0,0,0,0,0,0,0,0
7_13,Tel Mevorakh,7,Israel,Southern Levant,32.53333,34.91,"Found in a cut from a Bronze Age rampart, but dated by O. Bar-Yosef to the 'Pottery Neolithic'. Mentioned by Yellin and Perlman (1980) alongside Givat haParsa so will be assigned the same context.",,Yellin and Perlman 1980; Yellin and Perlman 1981; Yellin and Garfinkel 1986,Yellin and Perlman 1980; Yellin and Garfinkel 1986,,NAA,3,0,0,0,1,0,0,0,0,0,0,0,0,0,2,0,0,0,0,0,0,0,0,0,0,0,0,0,0,0,0,0,0,0,0
7_14,Tell Aray 1,7,Syria,Northern Levant,35.9,36.5,"El-Rouj 2d, 3","The five samples associated with unknown sources are broken down as: 4xC2, 1xD. ","Maeda, O. 2003","Maeda, O. 2003",,ED-XRF; ICP-AES,26,0,2,0,0,0,0,0,0,0,0,0,0,8,11,0,0,0,0,0,0,0,0,0,0,0,0,0,0,0,0,0,0,0,5
7_15,Tell Umm Qseir,7,Syria,Jezireh,36.41666667,41,Halaf,"The one unknown source was listed by Maeda 2003 as geochemical group ""B"". 37 other artefacts were analyzed by Mochizuki, but I could not find these results. ","Hole, F. and Johnson, G.A. 1987; Maeda, O. 2003","Maeda, O. 2003",,ED-XRF,8,0,0,0,0,0,0,0,0,0,0,0,0,2,5,0,0,0,0,0,0,0,0,0,0,0,0,0,0,0,0,0,0,0,1
7_16,Tilki Tepe,7,Turkey,Eastern Anatolia,38.45,43.333333,"niv. III (tranchée de Belck continué par Reilly jusqu'au sol vierge, de -6m -8 m): Halaf",The unknown sample supposedly has a similar chemical composition as 1g. ,"Renfrew, C. et al 1966; Renfrew, C. and Dixon, J. 1976; Pfeiffer, R.H. 1940; Wright, G.A. 1969; Ozdogan, M. 1977:39","Renfrew, C. et al 1966; Renfrew, C. and Dixon, J. 1976; Wright, G.A. 1969",,OES,11,0,0,0,0,0,0,0,0,0,0,0,0,0,3,6,0,0,0,0,0,0,0,0,0,0,0,0,0,0,0,0,1,0,1
7_17,Yarim II,7,Iraq,Jezireh,36.35,42.35,VIII-I: Middle ou Late Halaf; Halaf récent,,"Bader, N.O. 1994; Merpert, N. and Munchaev, R. 1987; Francaviglia, V. 1994","Bader, N.O. 1994; Chataigner 1998:283",,XRF; NAA,42,0,0,0,0,0,0,0,0,0,0,0,0,1,29,5,0,3,0,0,0,0,0,0,0,0,0,0,0,0,0,0,4,0,0
8_1,Abd el-Aziz,8,Syria,Northern Levant,35.883333,36.5,El Rouj 4,The unknown sample corresponds with Maeda's group C2. ,"Maeda, O. 2003","Maeda, O. 2003",,ED-XRF; ICP-AES,4,0,1,0,0,0,0,0,0,0,0,0,0,1,1,0,0,0,0,0,0,0,0,0,0,0,0,0,0,0,0,0,0,0,1
8_2,Arpachiyah,8,Iraq,Jezireh,36.366667,43.2,Chalcolithic; Mallowan et Rose: TT4-1 et cimetière: Late Ubaid,,"Renfrew, C. and Dixon, J. 1976; Renfrew, C. et al 1966; Healey, E. 2007; Forster, N. and Grave, P. 2012; Carter, T. pers comm.","Renfrew, C. and Dixon, J. 1976; Renfrew, C. et al 1966; Forster, N. and Grave, P. 2012; Carter, T. pers comm.; Cann, J.R. and Renfrew, C. 1964",McMaster University,pXRF; OES,10,0,0,0,0,0,0,0,0,0,0,0,0,2,2,6,0,0,0,0,0,0,0,0,0,0,0,0,0,0,0,0,0,0,0
8_3,Banahilk,8,Iraq,Northern Zagros,36.666667,44.533333,"Halafian, dating to around 5100-5000 BC according to Wright 1969:23",,"Braidwood, R.J. and Howe, B. 1960; Watson, P.J. 1983; Wright, G.A. 1969; Healey, E. 2007","Wright, G.A. and Gordus, A.A. 1969",,OES,11,0,0,0,0,0,0,0,0,0,0,0,0,0,7,4,0,0,0,0,0,0,0,0,0,0,0,0,0,0,0,0,0,0,0
8_4,Hazorea,8,Israel,Southern Levant,32.65,35.1,,The unknown cluster is the same as that from Tell Abdul Hosein. ,"Perrot, J. 1967","Wright, G.A. and Gordus, A.A.; Wright, G.A. 1969",,OES,4,0,1,0,0,0,0,0,0,0,0,0,0,2,1,0,0,0,0,0,0,0,0,0,0,0,0,0,0,0,0,0,0,0,0
8_5,Munhata,8,Israel,Southern Levant,32.616667,35.533333,"Layer 2A, Wadi Rabah Phase, early 5th millennium B.C. No obsidian from Layer 2B (Yarmoukian) has been sourced.",,"Benedict, P. et al 1980; Renfrew, C. et al 1966; Wright, G.A. and Gordus, A.A. 1969","Wright, G.A., 1969; Wright, G.A. and Gordus, A.A. 1969",,OES,12,0,5,0,0,0,0,0,0,0,0,0,0,4,3,0,0,0,0,0,0,0,0,0,0,0,0,0,0,0,0,0,0,0,0
8_6,Sabz,8,Iran,Southern Zagros,32.416667,47.25,Sabz Phase,,"Renfrew, C. 1977; Hole, F. 1977; Renfrew, C. 1976","Renfrew, C. and Dixon, J. 1976",,OES,1,0,0,0,0,0,0,0,0,0,0,0,0,0,0,1,0,0,0,0,0,0,0,0,0,0,0,0,0,0,0,0,0,0,0
8_7,Tell Kosak Shamali,8,Syria,Middle Euphrate,35.92,38.51,Early Northern Ubaid - levels 17-10 (Sector A),,"Nishiaki, Y. and Matsutani, T. 2003; Bellot-Gurlet, L. et al 2003","Bellot-Gurlet, L. et al 2003",Grenoble,REE; ICP-MS; ICP-AES,4,0,1,0,0,0,0,0,0,0,0,0,0,1,2,0,0,0,0,0,0,0,0,0,0,0,0,0,0,0,0,0,0,0,0
8_8,Tell Kurdu,8,Turkey,Northern Levant,36.35,36.51666667,Amuq C/Halaf; Amuq D/Transitional Halaf-Ubaid; Halaf final,,"Bressy, C. et al 2005; Delerue, S. 2007","Bressy, C. et al 2005; Delerue, S. 2007",Grenoble,ICP-MS; ICP-AES,21,0,5,0,0,0,0,0,0,0,4,0,0,7,4,1,0,0,0,0,0,0,0,0,0,0,0,0,0,0,0,0,0,0,0
9_1,Cark-in,9,Turkey,Central Anatolia,36.95,30.65,Late Chalcolithic,"The single analyzed specimen from this site was attributed to group 1e-f by Renfrew, but Chataigner 1998 suggests it may possibly have derived from Nenezi Dag. ","Kokten, K. 1963; Renfrew, C. et al 1966","Renfrew, C. et al 1966",,OES,1,0,0,0,1,0,0,0,0,0,0,0,0,0,0,0,0,0,0,0,0,0,0,0,0,0,0,0,0,0,0,0,0,0,0
9_2,Dalma,9,Iran,Northern Zagros,36.966667,45.4,niv. 5-4; Dalma Phase,,"Young, T.C. 1962; Hamlin, C. 1975; Renfrew, C. and Dixon, J. 1976; Chataigner, C. et al 2010","Renfrew, C. and Dixon, J. 1976",,OES,2,0,0,0,0,0,0,0,0,0,0,0,0,0,1,1,0,0,0,0,0,0,0,0,0,0,0,0,0,0,0,0,0,0,0
9_3,Degirmentepe,9,Turkey,High Valleys,38.466667,38.483333,Late Chalcolithic/Uruk,"13 specimens were analyzed, but no provenance was actually given by Tessadri 1987. The chemical characterization of 12 of these specimens was interpreted by Chataigner 1998:308. ","Balkan-Atli, N. 1995; Ozdogan, M. 1977:46; Yegingil, Z. 1983; Duru, R. 1979; Yegingil, Z. and Lunel, T. 1989","Tessandri, 1987; Yegingil and Lunel 1989; Yegingil, Z. 1983; Chataigner, C. 1998:308",Innsbruck,FT,13,0,0,0,0,0,0,0,0,0,0,0,0,10,2,0,0,0,0,0,0,0,0,0,0,0,0,0,0,0,0,0,0,0,1
9_4,Ghosha Tepe,9,Iran,Northern Zagros,38.564722,47.918611,Chalcolithic,3x Arteni (Aragats); 6x Sahand Mountain (Gegham S.); 1x Damlik (Gegham N.),"Hejabari Noubari, 2004; Ghorabi, S. et al 2010; Cherry, J.F. et al 2010","Ghorabi, S. et al 2010",,XRF; NAA,141,0,0,0,0,0,0,0,0,0,0,0,0,0,6,8,0,0,0,0,3,7,0,115,0,0,0,0,0,0,0,0,0,0,2
9_5,Kultepe,9,Iran,Northern Zagros,38.8,46.14,Chalcolithic,"Obsidian from the Bronze Age and Iron Age were also analyzed, but are not included here. ","Nadooshan, F.K. et al 2013","Nadooshan, F.K. et al 2013",University of Missouri Research Reactor (MURR),XRF,20,0,0,0,0,0,0,0,0,0,0,0,0,0,1,2,0,0,0,0,0,0,0,16,0,0,0,0,0,0,0,0,0,0,1
9_6,Oueili,9,Iraq,Mesopotamian plain,31.285833,45.853611,"fouille 1981, 1983: Obeid 3; niv. I-VI: Obeid 4",,"Coqueugniot, E. 1996; Inizan, M.L. and Tixier, J. 1983; Gratuze, B. et al 1993","Gratuze, B. et al 1993",,PIGE,5,0,0,0,0,0,0,0,0,0,0,0,0,0,2,0,0,0,0,0,0,0,0,3,0,0,0,0,0,0,0,0,0,0,0
9_7,Ras Shamra,9,Syria,Northern Levant,35.6,35.633333,"période 8 (début): niv. IV A: ""Chalcolithique Moyen II de Ras Shamra"" = Amuq D; période 8 (fin): niv. III C: ""Chalcolithique récent I de Ras Shamra"" = Amuq E (d'aprés Contenson 1982); niv. III B: ""Chalcolithique récent II de Ras Shamra"" = Amuq E (Contenson 1970) = Amuq First Mixed Range (Contenson 1982) = Obeid récent",,"Renfrew, C. et al 1966","Renfrew, C. et al 1966",,OES,2,0,1,0,0,0,0,0,0,0,0,0,0,1,0,0,0,0,0,0,0,0,0,0,0,0,0,0,0,0,0,0,0,0,0
9_8,Sabz,9,Iran,Southern Zagros,32.416667,47.25,Bayat Phase + Mehmeh Phase,,"Renfrew, C. 1977; Hole, F. 1977; Renfrew, C. 1976; Keene, A.S. 1981","Renfrew, C. and Dixon, J. 1976",,OES,3,0,1,0,0,0,0,0,0,0,0,0,0,0,2,0,0,0,0,0,0,0,0,0,0,0,0,0,0,0,0,0,0,0,0
9_9,Seh Gabi,9,Iran,Southern Zagros,34.583333,48.866667,"Dalma Phase, Seh Gabi Phase","For the Gutanasar sample, the natural specimen that the artefact's analysis was  compared against was from previously published data, and the zinc levels are slightly off. ","Young and Levine, 1974; Carter, T. (pers. comm.)","Carter, T. (pers. comm.)",McMaster University,ED-XRF,9,0,0,0,0,0,0,0,0,0,0,0,0,0,1,2,0,0,0,0,0,0,0,1,0,1,0,0,0,0,0,0,0,0,4
9_10,Shatanabad Tepe,9,Iraq,Northern Zagros,36.08,44.03,Dalma phase,,"Chataigner, C. et al 2010; Renfrew, C. and Dixon, J. 1976","Renfrew, C. and Dixon, J. 1976",,OES,2,0,0,0,0,0,0,0,0,0,0,0,0,0,0,1,1,0,0,0,0,0,0,0,0,0,0,0,0,0,0,0,0,0,0
9_11,Tabia,9,Iran,Northern Zagros,38.9,46.8,Dalma Phase,Renfrew suggests that the odd specimen attributed to group 1 is a fluke. ,"Renfrew, C. and Dixon, J. 1976; Chataigner, C. et al 2010","Renfrew, C. and Dixon, J. 1976",,OES,3,0,0,0,0,0,0,0,0,0,0,0,0,0,0,2,0,0,0,0,0,0,0,0,0,0,0,0,0,0,0,0,0,0,1
9_12,Tell Kosak Shamali,9,Syria,Middle Euphrate,35.92,38.51,Late Northern Ubaid - levels 9-4 (Sector A) + Sector B,,"Nishiaki, Y. and Matsutani, T. 2003; Bellot-Gurlet, L. et al 2003","Bellot-Gurlet, L. et al 2003",Grenoble,REE; ICP-MS; ICP-AES,5,0,0,0,0,0,0,0,0,0,0,0,0,1,4,0,0,0,0,0,0,0,0,0,0,0,0,0,0,0,0,0,0,0,0
9_13,Tell Kurdu,9,Turkey,Northern Levant,36.35,36.51666667,Amuq E/Ubaid,,"Bressy, C. et al 2005","Bressy, C. et al 2005",Grenoble,ICP-MS; ICP-AES,6,0,2,0,0,0,0,0,0,1,0,0,0,0,3,0,0,0,0,0,0,0,0,0,0,0,0,0,0,0,0,0,0,0,0
9_14,Tepe Gawra,9,Iraq,Jezireh,36.51666667,43.23333333,niv. XVI-XV: Ubaid; niv. XIV-XII: Late Northern Ubaid = Ubaid 4,,"Inizan, M.L. 1987; Tobler, A.J. 1950; Speiser, E.A. 1935","Renfrew, C. et al 1968",,OES,1,1,0,0,0,0,0,0,0,0,0,0,0,0,0,0,0,0,0,0,0,0,0,0,0,0,0,0,0,0,0,0,0,0,0
9_15,Thalathat,9,Iraq,Jezireh,36.383333,42.6,niv. XIV: Northern Ubaid = Ubaid 3; niveau séparé des niveaux inférieurs et supérieurs par des hiatus l'érosion; niv. XIII-XII A-B: Late Northern Ubaid = Ubaid 4,"Wright 1969's table 5 says [3x3a, 1x4c] but Wright and Gordus 1969's illustration 3 seemingly indicates that all four samples are 3a. ","Nishiaki, Y. 1995; Fukai, S. and Matsutani, T. 1981","Wright, G.A. 1969; Wright, G.A. and Gordus, A.A. 1969",,OES,4,0,0,0,0,0,0,0,0,0,0,0,0,0,1,3,0,0,0,0,0,0,0,0,0,0,0,0,0,0,0,0,0,0,0
9_16,Ubaid,9,Iraq,Mesopotamian plain,30.96666667,46.08333333,,,"Wright, G.A. 1969; Carter, T. (pers. comm.)","Wright, G.A. 1969; Carter, T. (pers. comm.)",,OES; ED-XRF,20,0,0,0,0,0,0,0,0,0,0,0,0,0,18,0,0,0,0,0,0,0,0,0,0,0,0,0,0,0,0,0,1,0,1
9_17,Yanik Tepe,9,Iran,Northern Zagros,37.95,45.983333,Chalcolithic,The 2 samples presented here as Ghegham South are actually simply listed as Gheghem by Carter et al 2014,"Burney, C. 1964; Burney, C. 1962; Burney, C. 1961; Renfrew, C. et al 1976; Chataigner, C. et al 2010; Wright, G.A. 1969","Renfrew, C. et al 1966; Carter et al 2014 (presentation)",,OES; ED-XRF,25,0,2,0,0,0,0,0,0,0,0,0,0,0,0,4,0,0,0,0,0,2,0,17,0,0,0,0,0,0,0,0,0,0,0
10_1,Agios Epiktitos Vrisy,10,Cyprus,Cyprus,35.3217,33.3883,,,"Peltenburg, E.J. 1979","Peltenburg, E.J. 1979",University of Michigan,NAA,1,0,1,0,0,0,0,0,0,0,0,0,0,0,0,0,0,0,0,0,0,0,0,0,0,0,0,0,0,0,0,0,0,0,0
10_2,Aphrodisias,10,Turkey,Western Anatolia,37.7083,28.7236,Late Chalcolithic 1 - 4360-3395 BC,"The unknown sample has high concentrations of Arsenic, Cesium, Barium and Scandium. ","Blackman, M.J. 1986; Joukowski, M.S. 1986","Blackman, M.J. 1986",Smithsonian,INAA,7,0,1,0,1,0,0,0,0,0,0,0,0,0,0,0,0,0,0,0,0,0,0,0,0,0,0,0,0,0,4,0,0,0,1
10_3,Arslantepe,10,Turkey,High Valleys,38.382023,38.36119,Similar to Amuq F,,"Fornaseri, M. et al 1975","Fornaseri, M. et al 1975",Rome,XRF,31,0,2,0,0,0,0,0,0,0,0,0,0,0,6,16,0,10,0,0,0,0,0,0,0,0,0,0,0,0,0,0,0,0,0
