Site ID,Site,ASPRO,Country,Region,Latitude,Longitude,Context,Notes,Citations,Chemical Characterization,Laboratory,Analytical Methods,Obsidian analyzed,Agicol,Gollu Dag East,Gollu Dag West,Nenezi Dag,Hasan Dag,Erciyes Dag,Erzincan,Erzerum,Pasinler,Sarikamis,Kars-Kagisman,Ikizdere,Bingol B,Nemrut Dag / Bingol A,Meydan Dag,Tendurek Dag,Suphan Dag,Mus,Kechut,Aragats / Arteni,Gegham,Vardenis / Khorapor,Sjunik,Baksan,Gutanasar,Kojun Dag / Chikiani,Hatis,West Anatolia,Demenegaki,Sta Nychia,Giali,3d high in rubidium,1e-f,Unknown
10_4,Brak,10,Syria,Jezireh,36.65,41.066667,Late Chalcolithic 2,,"Forster, S. and Grave, P. 2012; Khalidi, L. et al 2009","Forster, S. and Grave, P. 2012; Khalidi, L. et al 2009",,pXRF; XRF; LA-ICP-MS,12,0,0,0,0,0,0,0,0,0,0,0,0,3,8,1,0,0,0,0,0,0,0,0,0,0,0,0,0,0,0,0,0,0,0
10_5,Byblos,10,Lebanon,Northern Levant,34.116667,35.65,Levées XXXIX-XXXVIII: Enéolithique Ancien de Byblos.,,"Renfrew, C. et al 1966; Cauvin, J. 1962; Renfrew, C. and Dixon, J. 1976","Renfrew, C. et al 1966",,OES,1,0,1,0,0,0,0,0,0,0,0,0,0,0,1,0,0,0,0,0,0,0,0,0,0,0,0,0,0,0,0,0,0,0,0
10_6,Gilat,10,Israel,Southern Levant,31.3263,34.6487,"Chalcolithic, strata III-II, 4500 - 3500 B.C.E.",,"Yellin, J. et al 1996","Yellin, J. et al 1996",Hebrew University Archaoemetry Laboratory (Jerusalem),NAA,8,2,2,0,0,0,0,0,0,0,0,0,0,0,3,0,0,0,0,0,0,0,0,0,0,0,0,0,0,0,0,0,0,0,1
10_7,Hamoukar,10,Syria,Jezireh,36.8142,41.9568,Late Chalcolithic 2,One of the artefacts analyzed by Hall and Shackley is unknown but has similar composition to Zarnaki (Meydan Dag) source. Two of the aretafacts analyzed by Khalidi et al are unknown,"Hall, M.E. and Shackley, S. 1994; Khalidi, L. et al 2009","Hall, M.E. and Shackley, S. 1994; Khalidi, L. et al 2009",,EDXRF; NAA; LA-ICP-MS,42,0,0,0,0,0,0,0,0,0,0,0,0,2,36,2,0,0,0,0,0,0,0,0,0,0,0,0,0,0,0,0,0,0,2
10_8,Hassek Huyuk,10,Syria,Middle Euphrate,37.68333333,39.15,Chalcolithic,"Cauvin et al 1991 suggests that the two unknown specimens belong to Agicol or Bingol source groups, but is uncertain of this assessment. ","Cauvin, M.C. et al 1991","Cauvin, M.C. et al 1991",,ICP,10,0,0,0,0,0,0,0,0,0,0,0,0,7,1,0,0,0,0,0,0,0,0,0,0,0,0,0,0,0,0,0,0,0,2
10_9,Mersin,10,Turkey,Central Anatolia,36.833333,34.566667,niv. XVI : Chalcolithic.; niv. XV-XIV: Late Chalcolithic.,,"Garstang, J. 1953; Renfrew, C. et al 1966; Brice, W.C. 1953; Wright, G.A. 1969","Forster, N. and Grave, P. 2012",,pXRF,10,0,7,0,3,0,0,0,0,0,0,0,0,0,0,0,0,0,0,0,0,0,0,0,0,0,0,0,0,0,0,0,0,0,0
10_10,Sakyol,10,Turkey,High Valleys,38.9,38.833333,"niv. 13-12: ""Neolithic and Halaf""",,"Kosay, H.Z. 1976; Renfrew, C. et al 1966","Renfrew, C. et al 1966",,OES,2,0,0,0,0,0,0,0,0,0,0,0,0,1,0,0,0,0,0,0,0,0,0,0,0,0,0,0,0,0,0,0,0,1,0
11_1,Eridu,11,Iraq,Mesopotamian plain,30.86666667,45.983333,"Levels VII-VI, Campbell-Thompson Trench (Ubaid), 4000-3800 BC",,"Wright, G.A. 1969","Wright, G.A. 1969",,OES,4,0,0,0,0,0,0,0,0,0,0,0,0,0,4,0,0,0,0,0,0,0,0,0,0,0,0,0,0,0,0,0,0,0,0
11_2,Kushali Tepe,11,Iran,Northern Zagros,37.41,45.12,Pisdeli Period,,"Hole, F. et al 1969; Chataigner, C. et al 2010; Renfrew, C. and Dixon, J. 1976","Renfrew, C. and Dixon, J. 1976",,OES,2,0,0,0,0,0,0,0,0,0,0,0,0,0,0,1,0,0,0,0,0,0,0,1,0,0,0,0,0,0,0,0,0,0,0
11_3,Pisdeli,11,Iran,Northern Zagros,36.916667,45.416667,Hasanlu VIII,,"Dyson, R.H. and Young, T.C. 1960; Mahdavi, A. and Bovington, C. 1972; Renfrew, C. and Dixon, J. 1976; Chataigner, C. et al 2010","Mahdavi, A. and Bovington, C. 1972; Renfrew, C. and Dixon, J. 1976; Renfrew, C. et al 1966",,NAA; OES,4,0,0,0,0,0,0,0,0,0,0,0,0,0,2,1,1,0,0,0,0,0,0,0,0,0,0,0,0,0,0,0,0,0,0
x_1,Jaffarabad,10 or 11,Iran,Southern Zagros,32.43333333,48.3,c. 4000 BC,,"Mahdavi, A. and Bovington, C. 1972","Mahdavi, A. and Bovington, C. 1972",,OES,2,0,1,0,0,0,0,0,0,0,0,0,0,0,1,0,0,0,0,0,0,0,0,0,0,0,0,0,0,0,0,0,0,0,0
x_2,Marvdasht,10 or 11,Iran,Southern Zagros,29.8742,52.8025,c. 4500-3500 BC,,"Mahdavi, A. and Bovington, C. 1972","Mahdavi, A. and Bovington, C. 1972",,OES,5,0,0,0,0,3,0,0,0,0,0,0,0,0,2,0,0,0,0,0,0,0,0,0,0,0,0,0,0,0,0,0,0,0,0
x_3,Susa,10 or 11,Iran,Southern Zagros,32.189167,48.257778,"Acropolis - Susa A, 4200-3900 BCE",,"Renfrew, C. et al 1966; Renfrew, C. and Dixon, J. 1976","Renfrew, C. et al 1966; Renfrew, C. and Dixon, J. 1976; Mahdavi, A. and Bovington, C. 1972; Blackman, M.J. 1984",,NAA; OES,11,0,1,0,0,0,0,0,0,0,0,0,0,0,5,5,0,0,0,0,0,0,0,0,0,0,0,0,0,0,0,0,0,0,0
x_4,Tepe Yahya,10 or 11,Iran,Southern Zagros,28.330867,56.867317,"Yahya VI, 4500-3800 BC","Ten other samples from later/unstratified phases (6xZarnaki, 4xNemrut)","Piperno, M. 1973; Lamberg-Karlovsky, C.C. and Beale, T.H. 1986","Blackman, M. 1984",,PIGE,1,0,0,0,0,0,0,0,0,0,0,0,0,0,0,1,0,0,0,0,0,0,0,0,0,0,0,0,0,0,0,0,0,0,0
x_5,Hasanlu,11 or 12,Iran,Northern Zagros,37,45.58333333,4000-3000 BC,,"Mahdavi, A. and Bovington, C. 1972; Renfrew, C. et al 1966","Mahdavi, A. and Bovington, C. 1972; Renfrew, C. et al 1966",,OES,8,0,0,0,0,2,0,0,0,0,0,0,0,0,3,3,0,0,0,0,0,0,0,0,0,0,0,0,0,0,0,0,0,0,0
x_6,East Chia Sabz,2 and 3,Iran,Southern Zagros,32.416667,47.25,"Transitional Neolithic Period, early 9th to early 7th millenium BC, dates cannot be specified further",,"Darabi, H. and Glascock, M.D. 2013","Darabi, H. and Glascock, M.D. 2013; Darabi et al 2011",,XRF; NAA,20,0,0,0,0,0,0,0,0,0,0,0,0,0,20,0,0,0,0,0,0,0,0,0,0,0,0,0,0,0,0,0,0,0,0
x_7,Nahal Oren,2 or 3,Israel,Southern Levant,32.58333333,35.03333333,"PPNA/Early PPNB, impossible to specify further",,"Delerue, L. 2007","Delerue, L. 2007",,ICP-MS,2,0,1,0,0,0,0,0,0,0,0,0,0,0,0,0,0,0,0,0,0,0,0,0,0,0,0,0,0,0,0,0,0,0,1
x_8,Asikli,3 or 4,Turkey,Central Anatolia,38.35,34.233333,Proto-Neolithic (Todd),The obsidian analyzed was attributed simply as PPNB by Gratuze and can therefore not be separated among ASPRO periods 3 and 4 which correspond with layers 2+3 and 1 respectively.,"Balkan-Atli, N. et al 2001; Balkan-Atli, N. 1994; Gratuze, B. et al 1993; Balkan-Atli, N. and Cauvin, M.C. 1998; Gungordu, F.V. 2010; Chataigner, C. 1998; Schneider, G. 1994; Renfrew, C. et al 1968; Balkan-Atli, N. 1991","Gratuze, B. et al 1993; Schneider, G. 1994; Renfrew, C. et al 1968; Gratuze, B. et al 1994; Chataigner 1998:292",,PIGE,41,1,34,0,5,0,0,0,0,0,0,0,0,0,0,0,0,0,0,0,0,0,0,0,0,0,0,0,0,0,0,0,0,0,2
x_9,Byblos,8 or 9,Lebanon,Northern Levant,34.116667,35.65,Levées XLIII-XL: néolithique récent de Byblos.,,"Renfrew, C. et al 1966; Cauvin, J. 1962; Renfrew, C. and Dixon, J. 1976","Renfrew, C. et al 1966",,OES,3,0,1,0,0,0,0,0,0,0,0,0,0,1,1,0,0,0,0,0,0,0,0,0,0,0,0,0,0,0,0,0,0,0,0
x_10,Bakun B,9 or 10,Iran,Southern Zagros,29.81666667,52.93333333,niv. II; niv. I,,"Renfrew, C. et al 1966; Renfrew, C. and Dixon, J. 1976","Renfrew, C. et al 1966; Renfrew, C. and Dixon, J. 1976",,OES,3,0,0,0,0,0,0,0,0,0,0,0,0,0,3,1,0,0,0,0,0,0,0,0,0,0,0,0,0,0,0,0,0,0,0
x_11,Surezha,9 or 10,Iraq,Jezireh,35.999085,43.883674,Chalcolithic,,Stein and Alizadeh 2014,Stein and Alizadeh 2014,CNRS (Orléans),LA-HR-ICP-MS,25,0,0,0,0,0,0,0,0,0,2,0,0,0,16,6,0,0,0,0,0,0,0,0,0,0,0,0,0,0,0,0,1,0,0
x_12,Hammam et-Turkman,x,Syria,Jezireh,36.616667,38.983333,surface finds,,"Akkermans, P.M.M.G. 1988","Boerma, J.A.K. 1988",,XRF; AAS; NAA,3,0,0,0,0,0,0,0,0,0,0,0,0,0,1,2,0,0,0,0,0,0,0,0,0,0,0,0,0,0,0,0,0,0,0
x_13,Tell Arqa,x,Lebanon,Northern Levant,34.530556,36.045833,,Mixed/surface contexts,Khalidi et al. 2013; Thalmann 2006; Thalmann 2000,"Delerue, L. 2007",,MEB-EDS; ICP-MS,31,0,20,0,4,0,0,0,0,0,2,0,0,2,3,0,0,0,0,0,0,0,0,0,0,0,0,0,0,0,0,0,0,0,0